{
  "version": "people-portrait-source-decisions-v1",
  "status": "owner-approved",
  "ordering": "tmdb-person-id-ascending",
  "recordCount": 7,
  "records": [
    {
      "stableKey": "person:5064",
      "tmdbPersonId": 5064,
      "canonicalName": "Meryl Streep",
      "decision": "use-owner-selected",
      "registryProfilePath": "/g5cVxQBAQ3AXt3LhdBXtbbN47Uc.jpg",
      "approvedProfilePath": "/pSyM9cteYYWUBDalJzMPLH0SLgB.jpg",
      "approvedSourceHash": "a2b95053ae511d2f977298fa2dfb0a74c0656624ba83fad46c4907cf317aacb6",
      "decisionBasis": "Owner-selected source improves native detail and thumbnail definition in both independently generated formats.",
      "evidencePackage": "tools/people-seed/.work/people-owner-source-review",
      "approvedLandscapeOutputHash": "63cc449d2811f020fee567cf3c09552aa6bb082a07e7afc65da658d5cbfe4dc6",
      "approvedPosterOutputHash": "1cd90ef504a738d42bd7168642da4e8c2222598d3fbbd0d82350610c3477f73c",
      "ownerDecisionStatus": "approved",
      "fallbackIfUnavailable": "text-only"
    },
    {
      "stableKey": "person:8725",
      "tmdbPersonId": 8725,
      "canonicalName": "Olivia de Havilland",
      "decision": "use-owner-selected",
      "registryProfilePath": "/9pIjSCaOSIp9IbMVUaZhQ4dWc9F.jpg",
      "approvedProfilePath": "/g3scfKWRDJIFsuphfv3Ylo2GyGH.jpg",
      "approvedSourceHash": "86b030110fba0398d49127e9e5f9c9163e5be47fdae2cb6789de178fba2412d5",
      "decisionBasis": "Owner-selected source improves native detail and produces clearer dual-format crops with lower enlargement.",
      "evidencePackage": "tools/people-seed/.work/people-owner-source-review",
      "approvedLandscapeOutputHash": "074f8f63927ef418cb9978b97f8790e3674e2123100ab7fde07e1918db141ed3",
      "approvedPosterOutputHash": "d99c98ec298dee124a626263863976049bc7b2338cbfec5b4ac61261d12dd541",
      "ownerDecisionStatus": "approved",
      "fallbackIfUnavailable": "text-only"
    },
    {
      "stableKey": "person:9076",
      "tmdbPersonId": 9076,
      "canonicalName": "F. W. Murnau",
      "decision": "retain-registry-source",
      "registryProfilePath": "/keLp43iiIkkllroUwExIJITeR7a.jpg",
      "approvedProfilePath": "/keLp43iiIkkllroUwExIJITeR7a.jpg",
      "approvedSourceHash": "b8e0d32803b6de27c15652627243efa1ef1589cb1f6706a37d2e75679d7cf419",
      "decisionBasis": "Owner retained the approved Stage 3 registry source because the reviewed alternate was visibly softer and flatter.",
      "evidencePackage": "tools/people-seed/.work/people-owner-source-review",
      "approvedLandscapeOutputHash": "e18d24161781375b0954aa03e7b57688df928109e239bd244ee0f5e519b1d8aa",
      "approvedPosterOutputHash": "7805a12df792a0374a3e8e086d954e4dd5a68811cd82641dd9823b32c039d5ca",
      "ownerDecisionStatus": "approved",
      "fallbackIfUnavailable": "text-only"
    },
    {
      "stableKey": "person:13566",
      "tmdbPersonId": 13566,
      "canonicalName": "Edward G. Robinson",
      "decision": "use-owner-selected",
      "registryProfilePath": "/UkZdBmDs7Qw8caX7PlF1Spk8kR.jpg",
      "approvedProfilePath": "/sI3vtDTeGcV0uhumtZmYmfcOBav.jpg",
      "approvedSourceHash": "c8b5970d9e5d33b3a1bb66d5fa03cd1ca046774561e8302a5b0b054a47a9c16a",
      "decisionBasis": "Owner-selected source improves native detail and reduces enlargement in both formats while retaining a coherent crop.",
      "evidencePackage": "tools/people-seed/.work/people-owner-source-review",
      "approvedLandscapeOutputHash": "4dfc25b1275e2ff3ad472585a8fb79a5a296a72d6e73d61418f9e37fad2d3d19",
      "approvedPosterOutputHash": "af90395d8982450ab79c5f882a4e2c1573dc0edc8d7de6d3cde8acede9e3bd32",
      "ownerDecisionStatus": "approved",
      "fallbackIfUnavailable": "text-only"
    },
    {
      "stableKey": "person:14353",
      "tmdbPersonId": 14353,
      "canonicalName": "Max Ophüls",
      "decision": "retain-registry-source",
      "registryProfilePath": "/7fS9M8xuhcuE6swofTjvsLAWT3N.jpg",
      "approvedProfilePath": "/7fS9M8xuhcuE6swofTjvsLAWT3N.jpg",
      "approvedSourceHash": "a6ad9919a869acd874ada928c0152ca6af325e000f5447c892a9c8b0ff3fc7e2",
      "decisionBasis": "Owner reviewed the available TMDB options and retained the current approved registry source.",
      "evidencePackage": "tools/people-seed/.work/people-owner-source-review",
      "approvedLandscapeOutputHash": "b0933fe7986ff0f1ee274c76df569ccad7385f7adfa573fa994b0134f63ea2ba",
      "approvedPosterOutputHash": "21d6b2bb8810604e6affc284efc6fe31c31d1feae3d5932ad8f1e1cd56dbb301",
      "ownerDecisionStatus": "approved",
      "fallbackIfUnavailable": "text-only"
    },
    {
      "stableKey": "person:56208",
      "tmdbPersonId": 56208,
      "canonicalName": "Lucrecia Martel",
      "decision": "use-owner-selected",
      "registryProfilePath": "/e70SUgZRzx5fFZ49zgn2uCqw8Jm.jpg",
      "approvedProfilePath": "/szuJZR2uAyGnbhku6WjEM7JX8hK.jpg",
      "approvedSourceHash": "eba6d94eb2d36538d1d758e894b0ee65ef61d5c1ba0ad2b890e3487273465b7f",
      "decisionBasis": "Owner-selected source improves native resolution and remains crop-compatible in landscape and poster.",
      "evidencePackage": "tools/people-seed/.work/people-owner-source-review",
      "approvedLandscapeOutputHash": "d0f0466397e736f79b0f67566274d982a6ae2405239e04885d609448a86cee9d",
      "approvedPosterOutputHash": "45faa70aeb166cbdfbbf4204f3b41b3205cd16268057907114a7aee865558d11",
      "ownerDecisionStatus": "approved",
      "fallbackIfUnavailable": "text-only"
    },
    {
      "stableKey": "person:1079380",
      "tmdbPersonId": 1079380,
      "canonicalName": "Djibril Diop Mambéty",
      "decision": "retain-registry-source",
      "registryProfilePath": "/qP0a19xyKBoAY22ZsnJJy9Okfm6.jpg",
      "approvedProfilePath": "/qP0a19xyKBoAY22ZsnJJy9Okfm6.jpg",
      "approvedSourceHash": "631b5120b1729a19479c92ddfaa35ccc5e61a39a41318bf27953ee089d78ab43",
      "decisionBasis": "Owner reviewed the available TMDB options and retained the current approved registry source.",
      "evidencePackage": "tools/people-seed/.work/people-owner-source-review",
      "approvedLandscapeOutputHash": "18250a2281a428ae8add3088b8517f5b29aec1477ffe51da7dedf8ce229b1e92",
      "approvedPosterOutputHash": "aff7798ab2dae2b65a332b11319aac9d770443094c834612a1d6c27779e41e76",
      "ownerDecisionStatus": "approved",
      "fallbackIfUnavailable": "text-only"
    }
  ]
}
